{
  "analysisSchemaVersion": "1.1",
  "researchReleaseId": "11111111-1111-4111-8111-111111111111",
  "publishedAnalysisId": "16161616-1616-4161-8161-161616161616",
  "referenceSpanId": "17171717-1717-4171-8171-171717171717",
  "analysisType": "TRANSLATION_RESEARCH",
  "renderedSummary": "Fixture only. No scholarly conclusion is asserted.",
  "assertions": [
    {
      "assertionId": "18181818-1818-4181-8181-181818181818",
      "assertionText": "Fixture assertion demonstrating assertion-level evidence linkage.",
      "assertionType": "FIXTURE",
      "confidenceClass": "TEST_ONLY",
      "evidence": [
        {
          "publishedEvidenceItemId": "19191919-1919-4191-8191-191919191919",
          "stance": "SUPPORTS",
          "entailmentReviewStatus": "VERIFIED"
        }
      ]
    }
  ],
  "analysisHash": "6666666666666666666666666666666666666666666666666666666666666666"
}
